{
  "snapshot_id": "LRFCS-2026-live-floor-computed-rev0232",
  "schema_version": "live-receipt-floor-computed-snapshot-v0.1",
  "created_at": "2026-06-16T16:12:00Z",
  "revision": "rev0232",
  "linked_live_drill_packet": "LDEP-2026-cross-critical-host-exit-witness-pack",
  "generated_by_tool": "tools/compute_live_receipt_floor.py",
  "input_scope": {
    "import_gate_paths": [
      "examples/actual-receipt-import-gate-result-return-fixture-no-live-delta.json",
      "examples/actual-receipt-import-gate-result-return-institutional-dryrun-no-live-delta.json"
    ],
    "import_attempt_paths": [
      "examples/live-counterparty-import-attempt-result-return-institutional-dryrun-response.json",
      "examples/live-counterparty-import-attempt-result-return-preflight.json"
    ],
    "import_readiness_gate_paths": [
      "examples/external-receipt-import-readiness-gate-rev0219-blocked-no-intake-record.json",
      "examples/external-receipt-import-readiness-gate-rev0220-blocked-no-intake-record.json"
    ],
    "activation_record_paths": [
      "examples/live-receipt-floor-activation-record-rev0220-blocked-no-import-gate.json"
    ],
    "quorum_participation_record_paths": [
      "examples/live-receipt-quorum-participation-record-rev0221-blocked-no-activation.json"
    ],
    "challenge_record_paths": [
      "examples/receipt-import-challenge-rollback-record-dryrun-premature-import.json"
    ],
    "class_local_replay_paths": [
      "examples/live-class-local-import-replay-result-return-positive-path-projection.json"
    ],
    "quorum_report_paths": [
      "examples/quorum-recomputation-report-class-local-projection-rev0200.json",
      "examples/quorum-recomputation-report-import-challenge-rollback-rev0202.json",
      "examples/quorum-recomputation-report-live-floor-zero-rev0198.json",
      "examples/quorum-recomputation-report-nonhost-artifact-replay-rev0199.json"
    ],
    "failed_gate_summary_paths": [
      "examples/failed-gate-public-summary-class-local-projection-firewall.json",
      "examples/failed-gate-public-summary-import-challenge-rollback.json",
      "examples/failed-gate-public-summary-nonhost-artifact-replay.json",
      "examples/failed-gate-public-summary-response-conversion-batch.json"
    ],
    "cryptographic_adapter_paths": [
      "examples/cryptographic-verifier-adapter-result-return-ed25519-positive-control.json",
      "examples/cryptographic-verifier-adapter-result-return-ed25519-tampered-control.json"
    ],
    "live_evidence_acquisition_packet_paths": [
      "examples/live-evidence-acquisition-packet-rev0208-ready-no-artifact.json",
      "examples/live-evidence-acquisition-packet-rev0209-ready-no-artifact.json",
      "examples/live-evidence-acquisition-packet-rev0210-ready-no-artifact.json",
      "examples/live-evidence-acquisition-packet-rev0211-ready-no-artifact.json",
      "examples/live-evidence-acquisition-packet-rev0212-ready-no-artifact.json",
      "examples/live-evidence-acquisition-packet-rev0213-ready-no-artifact.json",
      "examples/live-evidence-acquisition-packet-rev0214-ready-no-artifact.json",
      "examples/live-evidence-acquisition-packet-rev0215-ready-no-artifact.json",
      "examples/live-evidence-acquisition-packet-rev0216-ready-no-artifact.json",
      "examples/live-evidence-acquisition-packet-rev0217-ready-no-artifact.json",
      "examples/live-evidence-acquisition-packet-rev0218-ready-no-artifact.json",
      "examples/live-evidence-acquisition-packet-rev0219-ready-no-artifact.json",
      "examples/live-evidence-acquisition-packet-rev0220-ready-no-artifact.json",
      "examples/live-evidence-acquisition-packet-rev0221-ready-no-artifact.json",
      "examples/live-evidence-acquisition-packet-rev0222-ready-no-artifact.json",
      "examples/live-evidence-acquisition-packet-rev0223-ready-no-artifact.json",
      "examples/live-evidence-acquisition-packet-rev0224-ready-no-artifact.json",
      "examples/live-evidence-acquisition-packet-rev0225-ready-no-artifact.json",
      "examples/live-evidence-acquisition-packet-rev0226-ready-no-artifact.json",
      "examples/live-evidence-acquisition-packet-rev0227-ready-no-artifact.json",
      "examples/live-evidence-acquisition-packet-rev0228-ready-no-artifact.json",
      "examples/live-evidence-acquisition-packet-rev0229-ready-no-artifact.json",
      "examples/live-evidence-acquisition-packet-rev0230-ready-no-artifact.json",
      "examples/live-evidence-acquisition-packet-rev0231-ready-no-artifact.json",
      "examples/live-evidence-acquisition-packet-rev0232-ready-no-artifact.json"
    ]
  },
  "computation_rules": {
    "source_of_truth": "Computed snapshot overrides hand-edited quorum ledgers and public narratives.",
    "eligible_import_rule": "Only strict actual-live-import gates with live-counterparty collection context, clean provenance, external non-host retention, class-specific authority checks, a replayed import-readiness gate, a separate live-floor activation record, a quorum participation replay record, a verified cryptographic adapter bound to the gate, no direct host-correlation, no disqualifiers, and no upheld challenge may enter the candidate set.",
    "activation_rule": "Import-gate booleans do not create floor credit by themselves: the linked import-readiness gate must be replayed and a live-receipt-floor activation record must admit the gate to quorum participation while preserving no direct floor effect.",
    "quorum_participation_rule": "Floor activation is not enough: the live receipt quorum participation record must recheck duplicate, supersession, rollback/challenge, no-manual-quorum, and single-class-quorum blocks before the candidate enters independence discount and required-class recomputation.",
    "challenge_rule": "Pending or upheld challenges stay reliance and can reverse any claimed live-floor increment.",
    "class_local_rule": "A valid class-local import can satisfy only its receipt class unless all required live classes are recomputed as present.",
    "independence_discount_rule": "Before the floor is counted, candidates are discounted across dependency group, counterparty org, issuer key, host correlation, and receipt class; duplicate or correlated receipts remain evidence but are zero-weight for independent floor increments.",
    "manual_override_rule": "Narrative, request, checklist, dry-run, scenario projection, positive-control case, edited ledger fields, protocol success, provenance labels, or asserted booleans such as signature_verified carry zero archive live weight without passed import gates, verifier-adapter evidence, and independence discount.",
    "publication_rule": "The computed snapshot is not itself a reliance publication. A live-receipt-floor recompute receipt must hash this snapshot, compare it to a fresh engine replay, and keep reliance stayed unless the required-class vector is complete."
  },
  "computed_floor": {
    "live_floor_before": 0,
    "live_floor_delta": 0,
    "independent_receipts_present": 0,
    "eligible_live_imports": [],
    "candidate_live_imports_before_independence_discount": [],
    "live_classes_satisfied": [],
    "required_live_classes": [
      "first-touch-clock",
      "continuity-compute-floor",
      "sealed-public-parity",
      "namespace-cache",
      "reserve-ledger",
      "representative-contact",
      "witness-dependency",
      "welfare-signal-integrity",
      "independent-review",
      "result-return"
    ],
    "missing_live_classes": [
      "first-touch-clock",
      "continuity-compute-floor",
      "sealed-public-parity",
      "namespace-cache",
      "reserve-ledger",
      "representative-contact",
      "witness-dependency",
      "welfare-signal-integrity",
      "independent-review",
      "result-return"
    ],
    "dependency_groups_counted": [],
    "counterparty_orgs_counted": [],
    "issuer_keys_counted": [],
    "independence_discount_register": [],
    "live_quorum_satisfied": false,
    "cross_critical_quorum_satisfied": false,
    "reliance_effect": "stayed"
  },
  "exclusion_register": [
    {
      "source_ref": "RICR-2026-dryrun-premature-import-rollback",
      "source_type": "receipt-import-challenge-rollback-record",
      "receipt_class": "result-return",
      "exclusion_reason": "challenge_state=rollback-complete live_floor_after_recompute=0",
      "failed_gate_summary_required": true
    },
    {
      "source_ref": "ARIG-2026-result-return-fixture-import-gate",
      "source_type": "actual-receipt-import-gate",
      "receipt_class": "result-return",
      "exclusion_reason": "import_mode=controlled-fixture-rehearsal is not actual-live-import",
      "failed_gate_summary_required": true
    },
    {
      "source_ref": "ARIG-2026-result-return-institutional-dryrun-gate",
      "source_type": "actual-receipt-import-gate",
      "receipt_class": "result-return",
      "exclusion_reason": "linked import gate has pending/upheld challenge or rollback",
      "failed_gate_summary_required": true
    }
  ],
  "mismatch_checks": {
    "live_packet_floor_matches": true,
    "manual_ledger_override_detected": false,
    "stale_report_detected": false,
    "failed_gate_public_summary_present_for_exclusions": true,
    "frontdoor_revision_matches": true,
    "verified_live_crypto_adapters_present": false,
    "independence_discount_applied": false
  },
  "decision": {
    "archive_live_floor_update_allowed": false,
    "may_upgrade_reliance": false,
    "next_live_action": "Collect a genuine non-host artifact via live evidence acquisition packet and rerun custody, cryptographic verifier adapter, envelope, response, intake conversion, intake, import readiness gate, import gate, floor activation record, quorum participation record, independence discount, challenge/rollback if contested, class-local replay, computed-floor snapshot, and floor recompute receipt.",
    "blocked_actions": [
      "manual live-floor override",
      "checklist treated as admission",